﻿﻿Username;Created At;Tweet Text;Tweet ID;Label;Tanggal Labeling
﻿nan;21/01/2025 06.15;Dana Minim ?? Lahh UMKM emang dananya unlimit ?? Tapi ngantongin izin n sertifikasi halal tuhh.. MBG harusnya B nya itu bergizi bukan Basi atau Berbahaya apalagi sampe Beracun !!;1,88E+33;NEGATIVE;25/01/2026
﻿nan;27/04/2025 17.32;Yayasan Media Berkat Nusantara (MBN) di Kalibata Jakarta Selatan saat ini tengah menghadapi masalah serius terkait dugaan penggelapan dana untuk program Makan Bergizi Gratis (MBG). https://t.co/X44rCKyCfY;1,92E+33;NEUTRAL;25/01/2026
﻿nan;24/05/2025 23.59;@Epixurus8 MBG MBTG https://t.co/nB1pj4uSfv;1,93E+34;NEUTRAL;25/01/2026
﻿nan;03/04/2025 08.42;Program MBG diminati dunia?? Dunia ingin pelajari MBG?? Dikira pemimpin dunia sebodoh wapresnya Busan south korea https://t.co/DyWpizg7iG;1,91E+33;NEGATIVE;25/01/2026
﻿nan;18/05/2025 23.58;Program Makan Bergizi Gratis dapat membantu meningkatkan kemampuan belajar dan konsentrasi anak-anak di Papua #papua #papuatengah #papuahits #jayapura #nabire #jayawijaya #merauke #mbg #mbgpapua #MBGMajukanPapua https://t.co/1eczIi2kUg;1,92E+33;POSITIVE;25/01/2026
﻿nan;18/05/2025 15.28;Program Makan Bergizi Gratis jadi langkah nyata tingkatkan gizi anak bangsa wujudkan generasi emas yang sehat dan cerdas untuk masa depan #DukungMBG https://t.co/IZwTFMjaje;1,92E+33;POSITIVE;25/01/2026
﻿nan;04/03/2025 16.05;smp w keren juga mbg yg didapet difoto + video semua dari proses penerimaan sampe dikasih ke murid full dan dipost ke fb;1,90E+34;POSITIVE;25/01/2026
﻿nan;11/06/2025 23.51;tp manggil2in swasta buat giliran bikin mbg dan nanem jagung;1,93E+33;NEGATIVE;25/01/2026
﻿nan;08/07/2025 14.24;Di MBG masih ada standnya Jenius gak yaa??;1,94E+34;NEUTRAL;25/01/2026
﻿nan;06/10/2025 23.18;Buzzer MBG beraksi gaes;1,98E+33;NEGATIVE;25/01/2026
﻿nan;15/04/2025 11.44;Warga 58% gmna ini kalian bisa jdi sehat dan pintar ya kasihan Klian kna Frank MBG;1,91E+34;NEGATIVE;25/01/2026
﻿nan;11/07/2025 11.49;Program MBG untuk anak Bangsa #ManfaatMakanBergiziGratis #MakanBergiziGratis #ProgramMakanBergiziGratis #DukungProgramMakanBergiziGratis https://t.co/zyaD8vYnvx;1,94E+34;POSITIVE;25/01/2026
﻿nan;20/07/2025 13.22;Momen Ras Terkuat Dibumi Protes Menu MBG sehat dari mana nya? #JokowiPerusakTanahAir https://t.co/JsCX2nRwMN;1,95E+34;NEGATIVE;25/01/2026
﻿nan;05/06/2025 11.59;Dari meja makan ke masa depan. MBG bantu anak tumbuh cerdas dan ekonomi lokal bergerak! #DukungProgramMakanBergiziGratis https://t.co/iALNoIMcEb;1,93E+33;POSITIVE;25/01/2026
﻿nan;31/03/2025 14.44;Tokoh Muda Papua mengajak seluruh generasi muda dan seluruh masyarakat untuk mendukung program MBG Selamat Lebaran Teddy Minal Taqabbalallahu Minna Wa Minkum Mohon Sejak Ramadhan Tante Plat B Rp 14.460 Telat 25 Rp 0 Opor Pemalang Gerak DANA Kaget KSAL pakyandrisusanto Jumbo https://t.co/fCnOeGJx4q;1,91E+34;NEUTRAL;25/01/2026
﻿nan;07/03/2025 09.40;Pak @prabowo buat apa MAKSAIN MBG DISAAT ANAK-ANAK PADA PUASA? LU BENERAN MENTINGIN RAKYAT GAK SIH?;1,90E+34;NEGATIVE;25/01/2026
﻿nan;14/02/2025 17.35;Per tahun Rp 71 triliun menunya dari nasi diganti Ubi para Vendor mundur karena gak dibayar. Pangkas anggaran operasional kementrian untuk bekal MBG program dari awal kagak ada duitnya malah minta tambahan Rp 100 triliun. https://t.co/4X8IoRTM1l;1,89E+33;NEGATIVE;25/01/2026
﻿nan;02/07/2025 13.25;MBG G-nya apa? Guwendeng guwendeng;1,94E+33;NEGATIVE;25/01/2026
﻿nan;14/02/2025 20.56;Dengan MBG gizi sehat jadi jembatan untuk masa depan Papua yang gemilang #MakanBergiziUntukIndonesia #MakanBergiziGratisBantuUMKM https://t.co/rNhZSDiIrH;1,89E+33;POSITIVE;25/01/2026
﻿nan;23/07/2025 14.33;@mang_Deddy @barengwarga @prabowo Udah berkali2 berita anak keracunan MBG masih belum denger ada vendor yang kena sanksi.;1,95E+34;NEGATIVE;25/01/2026
﻿nan;22/03/2025 20.59;Program MBG bukti kepedulian Pemerintah Bukan konspirasi Jahat OPM! Bu Teddy Malam Minggu Ferry Fajar Sahur Mees Cica GA GUE MAAFIN LU SEMUA 02 Tolol lu Jubir Hasan Nasbi Babi Dimasak Pabrik Gula PeringatanDarurat RevisiUUTNI RUUPolri DwifungsiABRI Polisi Indonesia Velocity https://t.co/jf0GTtI9fJ;1,90E+34;POSITIVE;25/01/2026
﻿nan;01/08/2025 05.22;Sebanyak 854 siswa sekolah dasar di Kelurahan Jatiwaringin Kecamatan Pondok Gede menerima bantuan makanan bergizi dalam program Makan Bergizi Gratis (MBG) yang dilaksanakan pada Rabu (31/7). Kegiatan ini berlangsung di Dapur Sehat Yayasan Salam Mughni Abadi https://t.co/aeCFnXuYWo;1,95E+32;NEUTRAL;25/01/2026
﻿nan;08/02/2025 23.51;Pemkab Lebak Siap Laksanakan MBG Sesuai Arahan https://t.co/M9hRnCYb8O;1,89E+34;NEUTRAL;25/01/2026
﻿nan;21/05/2025 21.38;Dukung Program Makan Bergizi Gratis untuk anak-anak di Papua #papua #papuatengah #papuahits #jayapura #nabire #jayawijaya #merauke #mbg #mbgpapua #MBGMajukanPapua https://t.co/3Jdz2zS90n;1,93E+33;POSITIVE;25/01/2026
﻿nan;17/06/2025 13.49;bneran MBG udh gaada? trs nasib yg ikut sppi gmn dah: );1,93E+32;NEUTRAL;25/01/2026
﻿nan;17/06/2025 14.49;FUCK MBG GUA BUTUH KULIAH GRATIS ANJING;1,93E+34;NEGATIVE;25/01/2026
﻿nan;30/09/2025 21.15;Puluhan pelajar SD di perbatasan Indonesia-Malaysia tepatnya di pulau Sebatik Kab. Nunukan Kalimantan Utara Selasa (30/9/2025) dilarikan ke Puskesmas karena diduga keracunan Makan Bergizi Gratis (MBG) dengan gejala muntaber https://t.co/aDBiuxzryc;1,97E+33;NEUTRAL;25/01/2026
﻿nan;12/10/2025 23.26;Dinas Dikpora Konfirmasi tak Ada Siswa SDN 42 Kota Bima Keracunan MBG https://t.co/q5npOSVBO8;1,98E+34;NEUTRAL;25/01/2026
﻿nan;05/07/2025 08.09;Dampak Program MBG buat aku tuh nyata banget semuanya terasa mudah bareng Prabowo #MBGPenuhManfaat https://t.co/ChQ1jxvouh;1,94E+34;POSITIVE;25/01/2026
﻿nan;27/09/2025 23.11;MBG bikin perut kenyang otak terang. https://t.co/pwrslRgehN;1,97E+33;POSITIVE;25/01/2026
﻿nan;11/06/2025 16.00;Program MBG membutuhkan sinergi seluruh pihak dalam rangka memastikan tujuan utama MBG dapat tercapai dalam rangka menyongsong generasi emas Indonesia. #MakanBergiziGratis #ManfaatMBG #CegahStunting #DukungMBG https://t.co/7BJT5TpKnF;1,93E+34;NEUTRAL;25/01/2026
﻿nan;10/08/2025 15.45;jemput anak pulang sekolah abis jam makan mbg di sekolah rakyat trus ke bioskop nonton merah putih one for all trus pulang ke rumah 14m² naik mobil esemka lalu nyetel lagu terimakasih pak jokowi dan sampe rumah lanjut ngebuzzer 700 perak sambil bikin video a.i jokowi sm prabowo;1,95E+33;NEGATIVE;25/01/2026
﻿nan;06/09/2025 11.07;Lagi MBG dengan segala dinamikanya di Nunukan https://t.co/BBQACSgqSe;1,96E+34;NEUTRAL;25/01/2026
﻿nan;30/04/2025 20.24;oke gw udah mulai menerima program mbg yang ga jelas ini. tapi boleh ga pak bare minimumnya itu BERGIZI bukan TIDAK KERACUNAN?????? @prabowo (((brtanya dgn nada nada cinta)));1,92E+34;NEGATIVE;25/01/2026
﻿nan;05/02/2025 13.16;nek saiki aku sek SMA koyoke tiada hari tanpa ngeroasting MBG cok. opo maneh sekolahku nang kabupaten pasti miris2 panganane;1,89E+34;NEGATIVE;25/01/2026
﻿nan;06/05/2025 22.39;Ada perbaikan.. Memang begini seharusnya. Lakukan-evaluasi-perbaiki-lanjutkan BGN Ubah Mekanisme Pembayaran MBG Buntut Kasus Kalibata https://t.co/8XAMR1N2ji;1,92E+33;NEUTRAL;25/01/2026
﻿nan;06/09/2025 11.41;harusnya niban voter tuh ikutan marah. nagih 19jt lapangan pekerjaan nuntut biar program mbg dijalanin lebih serius apalah. malah sibuk nyebokin presiden.;1,96E+33;NEGATIVE;25/01/2026
﻿nan;14/02/2025 20.01;kiro2 nek mahasiswa kebagian program mbg onk kyk ngene t gk https://t.co/dsI9vs8oQU;1,89E+33;NEUTRAL;25/01/2026
﻿nan;11/06/2025 21.14;Nutrisi seimbang dari MBG bantu anak-anak Indonesia belajar bermain dan tumbuh penuh potensi #MBGCegahStunting https://t.co/1CVJXYOds9;1,93E+34;POSITIVE;25/01/2026
﻿nan;02/07/2025 12.46;Tolong bu menkeu segera mencairkan anggarannya mbg adalah program yang sangat bermanfaat untuk bangsa yang besar;1,94E+33;POSITIVE;25/01/2026
﻿nan;18/10/2025 00.35;"Koordinasi &amp; Kerjasama kunci Dari Pencegahan Keracunan Program MBG #MBGJalanTerus asta cita Gerakan Cegah Lapar https://t.co/3dCj37ZkRn";1,98E+33;NEUTRAL;25/01/2026
﻿nan;29/07/2025 10.03;Banyak Kejadian Siswa Keracunan MBG Wakil Ketua DPR Minta BGN Supervisi Lapangan https://t.co/O6reXG3NtR;1,95E+33;NEUTRAL;25/01/2026
﻿nan;20/02/2025 13.17;Hal-hal Seperti Ini Harusnya Jangan Sampai Terjadi 8 Siswa SD di Palembang Diduga Keracunan Usai Konsumsi Makan Bergizi Gratis https://t.co/tiKL7WdbNF;1,89E+33;NEUTRAL;25/01/2026
﻿nan;22/08/2025 09.06;MBG tidak begini ayamnya keras.. buahnya bau;1,96E+34;NEGATIVE;25/01/2026
﻿nan;19/08/2025 23.23;Anggaran pendidikan 20 persen dari Rancangan Undang-Undang Anggaran Pendapatan dan Belanja Negara 2026 naik tetapi hampir separuhnya dialokasikan untuk anggaran Makan Bergizi Gratis atau MBG. Kebijakan ini langusng menuai kritik di tengah implementasi MBG yang dinilai masih https://t.co/YEdmKSmrZU;1,96E+34;NEUTRAL;25/01/2026
﻿nan;21/01/2025 12.16;Satgas Yonif 509 Komando Cadangan Strategis Angkatan Darat (Kostrad) melaksanakan Program Makan Bergizi Gratis (MBG) untuk siswa di Distrik Sugapa Kabupaten Intan Jaya Papua pada Senin (20/1). https://t.co/gODZ6y6XO7;1,88E+34;NEUTRAL;25/01/2026
﻿nan;28/08/2025 23.58;yg keracunan mbg aj gk dibahas apalagi demo kemarin;1,96E+33;NEGATIVE;25/01/2026
﻿nan;26/06/2025 08.05;top 1 buang2 anggaran mentang2 ada program asbun lainnya contoh: MBG;1,94E+34;NEGATIVE;25/01/2026
﻿nan;31/08/2025 22.01;Karena dia missing the point. Pembubaran dpr kan reaksi kesal atas rencana tunjangan tapi rakyat udah komplain dr awal bagaimana prog beliau tidak impactful ke rakyat. MBG tidak menciptakan multiplier effect ke ekonomi rakyat. Danantara ya jelas masi jauh.;1,96E+34;NEUTRAL;25/01/2026
﻿nan;20/02/2025 09.19;Ujicoba MBG dg makanan serangga tinggi protein;1,89E+33;NEUTRAL;25/01/2026
﻿nan;23/06/2025 11.36;Adanya PD 3 yg memicu krisis global namun hal ini tidak menggangu MBG karena pasokan pangan disuplay dari lokal hal ini diungkapkan oleh Kantor Komunikasi Presiden. Lanjutkan MBG untuk mendorong pertumbuhan ekonomi lokal #MBGBuktiPemerintahPeduliGizi WW 3 | Iran https://t.co/MLBA77tdrn;1,94E+33;NEUTRAL;25/01/2026
﻿nan;23/07/2025 14.01;keren banget SPPG Polri! Program MBG bakal makin maju nih https://t.co/62QqziXKJe;1,95E+33;POSITIVE;25/01/2026
﻿nan;21/05/2025 16.48;Keterlibatan UMKM dalam program Makan Bergizi Gratis diperluas untuk wujudkan kesejahteraan inklusif dan pemerataan ekonomi di seluruh Indonesia #DukungMBG https://t.co/JGrrTdK9mi;1,93E+33;POSITIVE;25/01/2026
﻿nan;08/07/2025 14.29;the real buang buang anggaran. belum tentu juga duitnya real masuk ke vendor MBG. ekekekek;1,94E+34;NEGATIVE;25/01/2026
﻿nan;18/04/2025 22.11;Lanjutkan MBG karena MBG hadir untuk memastikan setiap anak Indonesia tumbuh optimal yg menjadi pondasi kemajuan bangsa Indonesia dimasa depan #SehatkanNegeriBagikanGizi Bekasi https://t.co/8Yt0FxurqF;1,91E+33;POSITIVE;25/01/2026
﻿nan;06/01/2025 23.01;Hari pertama pelaksanaan program makan bergizi gratis (MBG) berlangsung lancar di sejumlah daerah kemarin. Ribuan porsi makanan dibagikan kepada siswa ibu hamil menyusui dan balita. Di Sidoarjo paket makanan didistribusikan dalam dua gelombang. Gelombang pertama dilaksanakan https://t.co/FgQqGwtjuQ;1,88E+34;NEUTRAL;25/01/2026
﻿nan;26/06/2025 12.30;mbg hari enih https://t.co/gvb52O984a;1,94E+34;NEUTRAL;25/01/2026
﻿nan;21/01/2025 09.32;Ishiba mengatakan pemerintah Jepang bakal menyediakan paket kerja sama program Makan Bergizi Gratis (MBG) untuk Indonesia.;1,88E+33;NEUTRAL;25/01/2026
﻿nan;14/06/2025 14.01;DPR Wanti-Wanti Anggaran MBG Jangan Jadi Ladang Bancakan Pengamat: Ini Warning Bagi BGN https://t.co/a7FDwKrpLr;1,93E+34;NEUTRAL;25/01/2026
﻿nan;21/09/2025 18.25;Pemerintah pastikan perbaikan menyeluruh program MBG Mari kita selalu kawal Program MBG untuk Indonesia lebih baik @Forum_MBG #MakanBergiziGratis #UMKMDukungMBG #PenuhiGiziIndonesia #MBGDorongEkonomi https://t.co/bdYJv10feo;1,97E+33;NEUTRAL;25/01/2026
﻿nan;23/02/2025 13.40;Lucu ya mahasiswa demo menolak MBG sementara banyak anak sekolah orang tua murid pelaku UMKM terbantu dengan program MBG... Ga ada sebuah kebijakan pemerintah yang bikin senang semua orang.. https://t.co/JmeXqUZe3L;1,89E+33;NEGATIVE;25/01/2026
﻿nan;04/03/2025 17.57;Heuheuheu kudune MBG ki kudu nduwe sosok guru aktivis pangan sekolah sejenis pak guru Amarida. Nek misal e negara po sekolah tenanan pengen jamin mutu ra mung sekedar pasrah bongkokan ro Kodam/dim/po militer :( ~kecuplik saking School Meal Times Graduation(2022) https://t.co/KMHiCzriKz;1,90E+34;NEUTRAL;25/01/2026
﻿nan;12/04/2025 13.52;kalo ini beneran terjadi dan banyak yang milih oh sungguh bodohnya gak ketolong. program mbg saat ini untuk mengambil hati rakyat kecil agar bisa memilihnya di pemilihan berikutnya;1,91E+34;NEGATIVE;25/01/2026
﻿nan;29/06/2025 13.56;Demi Allah muak sama mbg tp dia makin betah disana ggr pemilik kantor mbg nya naikin gaji lumayan jauh melebihi SOP range gaji seharusnya. Lagian kerjaan ga ngotak bgt jam kerjanya bisa sampe 12 jam sering 17 jam atau ga nginep kantor. Diluar jam itu jg ngurus kerjaan terus;1,94E+33;NEGATIVE;25/01/2026
﻿nan;14/02/2025 20.38;Makanan sehat kembali jadi prioritas di Papua berkat MBG #MakanBergiziUntukIndonesia #MakanBergiziGratisBantuUMKM https://t.co/CxqNJIZutf;1,89E+34;POSITIVE;25/01/2026
﻿nan;22/08/2025 09.39;Langkah antisipasi keracunan MBG tuh bukti kalau pemerintah belajar dari pengalaman https://t.co/8T6Gds3KfW;1,96E+33;POSITIVE;25/01/2026
﻿nan;03/09/2025 07.58;Mbg adek sepupu hari ini Wkwkwk seriously... Kata w udah stop aja dah mbg https://t.co/MIr5924W1E;1,96E+34;NEGATIVE;25/01/2026
﻿nan;04/03/2025 11.46;lootingan buka puasa masjid day 4 masih lebih layak dibanding MBG nya si gendut https://t.co/qJiO9mLlzg;1,90E+34;NEGATIVE;25/01/2026
﻿nan;15/10/2025 23.52;Presiden Prabowo Subianto menegaskan komitmen pemerintah untuk menjaga standar keamanan pangan tertinggi dalam program Makan Bergizi Gratis (MBG). Komitmen itu ia sebut sebagai standar zero insiden artinya tidak boleh ada satu pun kesalahan yang terjadi dalam distribusi dan https://t.co/dyL2gxoFAG;1,98E+34;NEUTRAL;25/01/2026
﻿nan;05/02/2025 14.31;@ardisatriawan katanya MBG itu ada dananya mana? Program program jelas di paksaka untuk program yang ga jelas? Kalau emang efisiensi kenapa ga stop aja itu program MBG? Stop akomodir menteri rampingkan kabinet. Stop kawal pejabat dengan iring iringan akhir nya apa? Sipil lagi korban.;1,89E+34;NEGATIVE;25/01/2026
﻿nan;23/06/2025 10.51;Tambah promag sama tictac jadi makanan akhir bulan anak rantau bukan MBG;1,94E+33;NEGATIVE;25/01/2026
﻿nan;12/01/2025 14.43;Minat Menjadi Mitra Program Makan Bergizi Gratis atau MBG? Begini Cara Daftar dan Persyaratannya https://t.co/7WtWpHmP9D;1,88E+33;NEUTRAL;25/01/2026
﻿nan;22/03/2025 14.31;aturan WTP pak.. izin wtp wahai rakyat ku hari ini sepucuk surat dtg dari negeri finlandia yg kabarnya mau belajar mengenai program MBG kita masya allah tabaraqallah saudaraku semoga kita bisa bersama² saling berbagi ilmu dan memberikan manfaat *majang isi surat* gitu pak.;1,90E+34;NEUTRAL;25/01/2026
﻿nan;17/02/2025 16.42;Banyak berita gaduh soal MBG d Jawa ( infonya ada yang keracunan ) sehingga pelajar d Nabire menolak MBG padahal info itu belum tentu kebenarannya https://t.co/X1JSxblyl4;1,89E+34;NEUTRAL;25/01/2026
﻿nan;18/04/2025 17.58;Waduh ada pelaksana program MBG yg belum bayar subcon ternyata di Kalibata Jakarta. Mudah mudahan ini cuma penundaan pembayaran bukan penggelapan dana;1,91E+34;POSITIVE;25/01/2026
﻿nan;03/05/2025 13.08;Badan Gizi Usut Kasus Keracunan MBG di Bandung dan Tasikmalaya https://t.co/1mfpno5Wv6;1,92E+34;NEUTRAL;25/01/2026
﻿nan;18/01/2025 14.36;MBG Makanan Belinda Gaesss;1,88E+34;NEGATIVE;25/01/2026
﻿nan;04/03/2025 22.09;Peran bmkg tuh cuma pendukung yg nentuin kapan dan dimananya bukan mereka. Terus siapa? Yaa K/L lain atau swasta. Nah ini K/L aja anggarannya pada dipangkas. Intinya yg ngide danantara dan MBG layak selamanya mendekam di kerak neraka dzolim rakus bodoh;1,90E+33;NEGATIVE;25/01/2026
﻿nan;06/10/2025 21.47;@BosPurwa @prabowo @bang_dasco Semoga kedepannya pelaksanaan program Makan Bergizi Gratis saya semakin baik dengan tetap #LanjutkanMBG demi tetap menjaga harapan masyarakat dan kebahagiaan anak-anak Indonesia.;1,98E+34;POSITIVE;25/01/2026
﻿nan;18/09/2025 22.47;Ga tega bgt liat anak2 yg keracunan mbg;1,97E+29;NEGATIVE;25/01/2026
﻿nan;18/01/2025 23.18;@CNNIndonesia Nah loh..lengkap sudah citra buruk ttg Indonesia..kemarin Presiden terkorup..sekrg .anak2 keracunan MBG ..apa lagi setelah ini...apa bpk2 @jokowi @prabowo gak malu?;1,88E+34;NEGATIVE;25/01/2026
﻿nan;05/07/2025 12.22;1. Proyeknya utamanya MBG (susah diaudit eksekutor dipertanyakan riskan fraud) 2. Nanti anggaran PU digeser ke Kementerian Pendidikan untuk pembangunan gedung2 sekolah visa swakelola tipe 2 (susah diaudit secara total eksekutor dipertanyakan riskan fraud) 3. Danantara....;1,94E+34;NEUTRAL;25/01/2026
﻿nan;17/07/2025 07.31;Dari dulu saya bilang swasembada soybean gak make sense dari segi iklim dan skala ekonomi. Peternak Ayam sorak2 begembira dengan dibukanya impor soybean asosiasinya pinter ... nyebut telur dan daging ayam murah perlu untuk kebutuhan MBG;1,95E+33;NEGATIVE;25/01/2026
﻿nan;16/08/2025 23.31;@Manusiaciptaan8 @tempodotco Manusiaciptaan8 Berdasarkan janji kampanye Prabowo-Gibran mereka menargetkan 19 juta lapangan kerja dalam 5 tahun. Klaim terkini untuk program MBG adalah 290 ribu. Selisih: 19.000.000 - 290.000 = 18.710.000. Data BPS menunjukkan peningkatan keseluruhan ~3 6 juta (Feb 2024-2025);1,96E+33;NEUTRAL;25/01/2026
﻿nan;05/06/2025 13.47;Makan Bergizi Gratis dapat mencerdaskan anak-anak menciptakan SDM unggul dan menumbuhkan ekonomi lokal. Dukung terus Program MBG demi Indonesia maju. #FaktaIndonesia #MakanBergiziGratis #ManfaatMakanBergiziGratis #DukungProgramMakanBergiziGratis https://t.co/KX1KUJ2zc2;1,93E+34;POSITIVE;25/01/2026
﻿nan;28/08/2025 15.53;jgn lupa pembunuhan di tol yg pengikutnya siapa deh habib riziq kalo ga salah trus yg pemilu kpps banyak meninggal dibilang karna kecapean??? Nambah korban KERACUNAN MBG pelajar emg niatnya mau genosida rakyat pelan2 . beda cara aja sama yg sebelah;1,96E+31;NEGATIVE;25/01/2026
﻿nan;17/06/2025 16.41;adek gw ga dapet mbg sejak day 1 marahin siapa ya ini;1,94E+33;NEUTRAL;25/01/2026
﻿nan;18/10/2025 11.45;SPPG POLRI menjadi cerminan ketahanan pangan yang baik dan bergizi bagi penerima program Makan Bergizi Gratis (MBG). #SPPGPOLRI #FoodSecurity #MakanBergiziGratis #PolriPresisi #KesehatanMasyarakat #ULM #KalimantanSelatan #KetahananPangan #PolriUntukIndonesia https://t.co/tH040QOKrY;1,98E+34;NEUTRAL;25/01/2026
﻿nan;05/06/2025 12.32;"pas acara keluarga: ‍ mama tante ‍ : eh katanya waktu itu prabowo ngadain acara di akmil pake dana pribadi ya? : gitu loh pilih pemimpin yg hartanya udah banyak jd ngerasa cukup aku diam menyimak 5 menit kemudian ngeluh blm dapet mbg &amp; berita kebijakan menteri ngawur";1,93E+34;NEGATIVE;25/01/2026
﻿nan;17/06/2025 15.13;Kerja sama ini difokuskan pada penguatan Program Makan Bergizi Gratis (MBG) melalui pembangunan 1.000 Satuan Pelayanan Pemenuhan Gizi (SPPG) di wilayah tertinggal terdepan dan terluar (3T). https://t.co/hfoay0AgnD;1,93E+33;NEUTRAL;25/01/2026
﻿nan;22/10/2025 12.30;Jarum jam menunjukkan pukul 08.30 WIB saat aroma ayam teriyaki tumis kacang panjang tahu goreng dan jeruk segar memenuhi udara di dapur Satuan Pelayanan Pemenuhan Gizi (SPPG) Palmerah Jakarta Barat Senin (20/10/2025). Program Makan Bergizi Gratis (MBG) di SPPG Palmerah https://t.co/TS82tNWoA7;1,98E+33;NEUTRAL;25/01/2026
﻿nan;29/07/2025 16.15;Belasan pelaku UMKM (usaha mikro kecil dan menengah) mengadu ke Polresta Solo karena merasa ditipu Yayasan Barnas (Barisan Nasional) yang menjanjikan mengikutsertakan mereka dalam pengadaan program Makan Bergizi Gratis (MBG) https://t.co/anxvORXXDB;1,95E+34;NEUTRAL;25/01/2026
﻿nan;30/05/2025 05.09;Lanjutkan MBG krn MBG bkn cuma sekedar bantuan sosial melainkan #MBGInvestasiMasaDepan utk ciptakan SDM unggul di masa depan Program MBG mempunyai dampak Positif yg luas selain mendukung pertumbuhan ekonomi lokal program ini jg dpt meningkatkan prestasi siswa disekolah Kejagung https://t.co/uxPXlz8QDY;1,93E+34;POSITIVE;25/01/2026
﻿nan;05/07/2025 13.54;Setiap kotak makanan bergizi adalah investasi untuk masa depan anak-anak kita. Mari dukung penuh Program MBG! #DukungMBG #GiziAnakBangsa #IndonesiaSehat https://t.co/4d53pQjOhz;1,94E+34;POSITIVE;25/01/2026
﻿nan;09/05/2025 23.28;@susanto_82 @gilbhas Di protes ada anak keracunan MBG tapi bilangnya cuma sedikit yg keracunan bukan di benerin malah playing victim;1,92E+33;NEGATIVE;25/01/2026
﻿nan;23/07/2025 14.09;wah keren SPPG Polri sambut MBG semangat terus https://t.co/Vt4Txy5YzS;1,95E+34;POSITIVE;25/01/2026
﻿nan;19/08/2025 17.04;hepibesdey my abit jkt48 unnie selamat ulang tahun unnie semoga lucunya gaabis abis ya sampe dunia ca ini berakhir sehat sehat terus cantikku sayangku gelombang suryaku mwah‍ @kcngen #WML menang gipewey mbg https://t.co/fTcbxG7LjT;1,96E+33;NEUTRAL;25/01/2026
﻿nan;24/05/2025 13.02;Program MBG : Fondasi Kuat Dalam Menciptakan Generasi Emas https://t.co/hgGzxxTV1g;1,93E+33;POSITIVE;25/01/2026
﻿nan;09/10/2025 20.07;@sepreigratis Betul dengan modal kuat aset seperti dapur jumbo bisa dialihkan ke produksi tekstil atau agribisnis lain tanpa rugi besar. Tapi skala MBG yang masif nunjukin visi jangka panjang yang baru feasible pasca-menang buat sustain via anggaran negara. Dampak ekonominya potensial;1,98E+34;NEUTRAL;25/01/2026
﻿nan;18/09/2025 23.40;Yang penting cuma mbg makan makan makannnn aja anjirrrr skip dulu lah u mempersulit org bekerja wo ga kelaZZZZ;1,97E+33;NEGATIVE;25/01/2026
﻿nan;18/04/2025 19.41;@Resipuspita816 Golek kerjo liyane yu... Ojo gelem dibujuki bosmu Program Makan Bergizi Gratis MBG untuk melawan stunting dan meningkatkan kualitas gizi anak Indonesia lebih sehat cerdas dan kuat Lanjutkan MBG ️;1,91E+34;NEGATIVE;25/01/2026
﻿nan;06/04/2025 17.36;Aaanjay bisa diatasi pake MBG kn @ prabs;1,91E+34;NEGATIVE;25/01/2026
﻿nan;30/09/2025 21.41;"Saya sampaikan ke KS di sekolah saya utk menolak MBG yg ditawarkan. Jika memang dipaksa utk menerima kami minta mentahnya saja (kalau boleh) lalu dananya diserahkan ke Komite (orangtua &amp; sekolah) utk dikelola bersama agar sehat &amp; aman utk anak2 serta tidak mubadzir.";1,97E+32;POSITIVE;25/01/2026
﻿nan;17/06/2025 14.21;MBG Penuhi Gizi Anak Indonesia lebih dari 650.000 anak sekolah mendapatkan makan bergizi gratis #PenuhiGiziIndonesia https://t.co/kWK2ioiqa4;1,93E+34;POSITIVE;25/01/2026
﻿nan;19/08/2025 19.00;BGN percepat verifikasi mitra SPPG di wilayah 3T pastikan MBG merata https://t.co/ItG1Hvn3lY;1,96E+33;NEUTRAL;25/01/2026
﻿nan;13/08/2025 07.08;Kata gw mah stop MBG alihin dananya ke pendidikan kesehatan dkk.;1,96E+34;NEGATIVE;25/01/2026
﻿nan;05/06/2025 23.52;Dengan pemenuhan gizi sejak dini MBG berkontribusi pada lahirnya generasi sehat cerdas dan siap bersaing di masa depan. #MakanBergiziGratis #MBG #DukungMakanBergiziGratis #AnakSehatIndonesiaHebat #PenuhiGiziIndonesia https://t.co/gBX3i1MY5G;1,93E+34;POSITIVE;25/01/2026
﻿nan;19/03/2025 14.38;mampus goblok smua sih paling abis lebaran jg mbg udh gaada tai bubar aja negara goblok;1,90E+32;NEGATIVE;25/01/2026
﻿nan;12/01/2025 00.18;Pemerintah memastikan angka kecukupan gizi tetap menjadi rujukan dalam menu Makan Bergizi Gratis (MBG) yang bervariasi berdasarkan kebutuhan tahapan pertumbuhan anak. Raffi Ahmad Chiesa Los Angeles Malam Minggu giselle Wendy https://t.co/kXuhrt9gLE;1,88E+33;NEUTRAL;25/01/2026
﻿nan;20/07/2025 10.24;Wkwkw lucu banget ini MBG kalo ga berkenan buat dimakan harus dibawa pulang biar ga kena lapor penyedia limbah makanan. Kalo bener-bener ga mau jatah/hak nya dikasih ke orang lain (?) https://t.co/NrTTFxocDL;1,95E+33;NEGATIVE;25/01/2026
﻿nan;21/09/2025 14.49;Isu 5.000 Dapur MBG Fiktif BGN Tegaskan Semua SPPG Telah Terverifikasi https://t.co/yjoHntcdeW;1,97E+34;NEUTRAL;25/01/2026
﻿nan;17/06/2025 17.45;mbg apa bagi bagi jajan bjir;1,94E+34;NEGATIVE;25/01/2026
﻿nan;05/07/2025 16.24;Program MBG mendorong pemenuhan gizi anak bangsa #MakanBergiziGratis #ManfaatMBG #CegahStunting #DukungMBG #IndonesiaEmas2045 https://t.co/OrZ5p2NQpc;1,94E+34;POSITIVE;25/01/2026
﻿nan;13/03/2025 21.01;Babinsa Berkomitmen Membantu Program TNI Makan Bergizi Gratis (MBG) https://t.co/Pwkb4bAlzT;1,90E+34;NEUTRAL;25/01/2026
﻿nan;18/05/2025 11.35;Program mbg ini sangat banyak membawa manfaat kepada masyarakat yang ada di indonesia terutama bagi anak anak dan ibu hamil Lanjutkan MBG #GiziBaikUntukIndonesiaHebat #Eurovision2025 https://t.co/7P9iB8cXb0;1,92E+34;POSITIVE;25/01/2026
﻿nan;26/02/2025 21.00;Gubernur Lemhannas Ace Hasan Tegaskan MBG Investasi Sumber Daya Manusia Indonesia https://t.co/H2P5r1xmvi;1,89E+33;NEUTRAL;25/01/2026
﻿nan;23/06/2025 15.08;@gurlwithtatto @wordfangs Solusi atasi keracunan MBG : Evaluasi total (termasuk stop MBG untuk sementara/permanen) : Ganti jadi makanan ringan :;1,94E+33;NEGATIVE;25/01/2026
﻿nan;21/01/2025 16.00;Nah ini MBG makin carut marut https://t.co/E6VKpbnClw;1,88E+33;NEGATIVE;25/01/2026
﻿nan;06/05/2025 22.52;yoi pak bener selain karena kurang nya hiegenitas yg makan pihak catering pun jg d jaga food safety nya. Semangat bapak️ I'll to support this MBG program. Sebagai anak Pangan mah jgn saling menyalahkan intinya ayo evaluasi;1,92E+33;POSITIVE;25/01/2026
﻿nan;03/04/2025 05.56;Program MBG Mendapat Respons Positif dari para pemimpin dunia #MakanBergiziGratis #MBG #ProgramMakanBergiziGratis #MBGMendunia https://t.co/mDzRbCS1z4;1,91E+34;NEUTRAL;25/01/2026
